Date,Headline,Positive,Negative,Neutral
2022-04-24,Netflix: free riders will dismount rather than give streamers free rein,0.026317482814192772,0.038154177367687225,0.9355283975601196
2022-04-25,"Whatever happens, the Netflix effect is here to stay",0.03437133505940437,0.050165921449661255,0.9154627919197083
2022-04-26,"Warner Bros Discovery: Netflix slump and CNN flop augur badly for giant Premium
 content",0.01123427227139473,0.9615256190299988,0.027240080758929253
2022-04-26,FT readers respond: Netflix’s declining subscribers,0.009195337072014809,0.9702398180961609,0.02056487277150154
2022-04-27,Spotify chief distances music streaming group from Netflix,0.060106873512268066,0.014724049717187881,0.9251691102981567
2022-04-28,"After the Netflix crash, does Spotify face the same fate?",0.03304667770862579,0.2231753021478653,0.7437779903411865
2022-05-01,Silver screen fills with action as Netflix stumbles,0.10540265589952469,0.40647077560424805,0.4881264865398407
2022-05-04,The Netflix subscriber wobble raises new questions for Sony,0.039987314492464066,0.47361117601394653,0.4864015281200409
2022-05-09,Nightmarish Netflix special Our Father about the doctor who played god,0.07507210224866867,0.2883760631084442,0.6365518569946289
2022-05-11,Walt Disney gains ground on Netflix with strong growth in streaming,0.9517344236373901,0.015773840248584747,0.032491765916347504
2022-05-14,Cost-conscious consumers are the problem for Netflix,0.05783393606543541,0.34387537837028503,0.598290741443634
2022-05-16,Netflix’s U-turn puts TV advertisers back in vogue,0.40618422627449036,0.10051639378070831,0.4932994246482849
2022-05-25,Is the ‘subscription economy’ going to feel the Netflix effect?,0.05059514194726944,0.19458210468292236,0.7548227310180664
2022-05-29,Economics class: Is the ‘subscription economy’ going to feel the Netflix effect?,0.06288444995880127,0.11267624795436859,0.824439287185669
2022-06-08,"Netflix: de-Faanged but still spending  Premium
 content",0.060821108520030975,0.021859416738152504,0.9173194766044617
2022-06-16,Spiderhead — Chris Hemsworth is miscast in Netflix’s botched drugs experiment,0.025156332179903984,0.671808660030365,0.30303502082824707
2022-06-30,"The Sea Beast, Netflix — an inventive maritime adventure for the under 12s",0.19614112377166748,0.010743672959506512,0.7931151986122131
2022-07-12,Marvel directors Anthony and Joe Russo on The Gray Man: ‘Netflix is the least intrusive place we’ve worked’,0.07047402113676071,0.08489222079515457,0.8446337580680847
2022-07-13,Netflix teams up with Microsoft for ad-supported streaming tier,0.6136322617530823,0.009320090524852276,0.37704765796661377
2022-07-14,The Gray Man film review — Ryan Gosling lets the action do the talking in $200mn Netflix spectacle,0.11349856853485107,0.020156975835561752,0.8663444519042969
2022-07-19,Netflix loses 1mn subscribers but defections are fewer than feared,0.012342521920800209,0.9658785462379456,0.021778907626867294
2022-07-20,The Great Netflix Correction: loss of subscribers throws streaming business model into question,0.007940069772303104,0.9636937379837036,0.028366263955831528
2022-07-20,"Netflix: running up that hill in search of new subscribers Premium
 content",0.0753675177693367,0.02067342959344387,0.9039590358734131
2022-07-20,Wall Street stocks rise as Netflix pulls streaming rivals higher,0.1746096909046173,0.7602452635765076,0.06514501571655273
2022-07-20,"Netflix and streaming run out of steam Premium
 content",0.01692609302699566,0.40004482865333557,0.5830291509628296
2022-07-20,Netflix rallies despite subscriber losses,0.8822481036186218,0.07716786116361618,0.04058408737182617
2022-07-27,"Uncoupled, Netflix review — middle-aged gay romcom could do with fresher jokes",0.08849859237670898,0.01390397734940052,0.8975974321365356
2022-07-27,"Spotify/Netflix: music streaming is proving sticky, but not necessarily more profitable Premium
 content",0.7389837503433228,0.0378713496029377,0.22314496338367462
2022-07-27,Netflix dominance falters as it loses subscribers,0.008408704772591591,0.9637176394462585,0.027873650193214417
2022-08-05,The Sandman review — Neil Gaiman’s comics become a gloomy Netflix show,0.010245518758893013,0.9367913603782654,0.05296308547258377
2022-08-09,Bayreuth’s new Ring cycle promises Netflix-style drama — review,0.3578844666481018,0.00926918163895607,0.6328464150428772
2022-08-09,Netflix aims to become a serious player in the gaming sphere,0.4096394181251526,0.006825007498264313,0.5835356116294861
2022-08-10,Disney overtakes Netflix on streaming subscriptions,0.08164998143911362,0.010459549725055695,0.9078904390335083
2022-08-19,"Echoes, Netflix review — twin sisters swap lives in hammy box-ticking exercise",0.03560316935181618,0.11315341293811798,0.8512434363365173
2022-08-26,Netflix makes a smart bet on the Korean drama trade,0.2950018048286438,0.013129296712577343,0.6918689608573914
2022-09-01,Netflix is starting to look more like traditional TV,0.13001908361911774,0.011554870754480362,0.858426034450531
2022-09-07,Gulf states warn Netflix of legal action over ‘un-Islamic’ content,0.03650663420557976,0.8441532850265503,0.11934003978967667
2022-09-11,Netflix partners with Ubisoft to bolster fledgling gaming division,0.9185617566108704,0.008067451417446136,0.07337072491645813
2022-10-13,Netflix to launch ad-supported streaming option in November,0.16154316067695618,0.008487597107887268,0.8299692273139954
2022-10-13,The Playlist on Netflix dramatises the implausible rise of Spotify — review,0.05138711631298065,0.15962810814380646,0.7889847159385681
2022-10-18,"Netflix: advertising subscription could mean lower Arpu Premium
 content",0.022774016484618187,0.7952669858932495,0.18195904791355133
2022-10-18,Netflix shares jump after gaining 2.4mn subscribers,0.8998314738273621,0.04378800094127655,0.056380484253168106
2022-10-18,"The Watcher, Netflix review — true-crime thriller is all sensation and excess",0.028518937528133392,0.06481344997882843,0.9066675901412964
2022-11-02,Hollywood seeks a cut as Netflix debuts ad-supported streaming,0.053719598799943924,0.823975682258606,0.12230481207370758
2022-11-07,Fifa Uncovered — Netflix series asks why Qatar was awarded the World Cup,0.13905352354049683,0.02434285543859005,0.8366036415100098
2022-11-14,1899 — Netflix’s disorientating horror series set on fin-de-siècle steamship,0.04619712382555008,0.4876880347728729,0.4661148488521576
2022-11-18,Stutz review — Jonah Hill turns the tables on his shrink in Netflix documentary,0.07580036669969559,0.09774533659219742,0.826454222202301
2022-12-08,Harry & Meghan part one review — a Netflix appeal for both admiration and pity,0.24550510942935944,0.015605243854224682,0.7388896346092224
2022-12-16,Harry and Meghan fail to deliver royal knockout in second half of Netflix series,0.04525101184844971,0.7215949892997742,0.23315401375293732
2022-12-23,"Treason, Netflix review — the spy who should have stayed out in the cold",0.10691354423761368,0.0937860906124115,0.7993003726005554
2022-12-24,"Carbon counter: linear TV repeats are greener than buzzy Netflix premieres Premium
 content",0.14607258141040802,0.01245788298547268,0.8414695262908936
2023-01-02,Hollywood talent agencies seek new deals tied to Netflix ads,0.7024083137512207,0.012884954921901226,0.2847067713737488
2023-01-04,"Madoff: The Monster of Wall Street, Netflix — the story of the biggest Ponzi scheme in history",0.053108230233192444,0.04978532716631889,0.897106409072876
2023-01-04,"Kaleidoscope, Netflix — heist series makes the viewer choose",0.04037869721651077,0.034109681844711304,0.9255116581916809
2023-01-11,Unhappy endings — Netflix’s abrupt cancellations,0.010477953590452671,0.9443793296813965,0.0451427698135376
2023-01-13,Can Netflix’s Break Point revitalise tennis?,0.2141738086938858,0.011937006376683712,0.7738891839981079
2023-01-14,"Tennis pins its hopes on a Netflix renaissance Premium
 content",0.8641612529754639,0.01583688333630562,0.1200018897652626
2023-01-20,FirstFT: A new era for Netflix,0.14691822230815887,0.015539483167231083,0.8375423550605774
2023-01-20,"The Makanai: Cooking for the Maiko House, Netflix review — gentle drama of trainee geisha",0.09034516662359238,0.039216089993715286,0.8704387545585632
2023-01-20,Netflix's CEO steps down,0.017475195229053497,0.628353476524353,0.3541713356971741
2023-01-20,Netflix co-founder Reed Hastings to step down as chief executive,0.0155638437718153,0.5651785731315613,0.4192575514316559
2023-01-20,Netflix’s Reed Hastings: the ‘system builder’ who brought revolution,0.11521196365356445,0.02436329983174801,0.8604247570037842
2023-01-27,"Pamela, a Love Story review — an intimate and touching Netflix documentary",0.0735085979104042,0.0239045862108469,0.9025868773460388
2023-02-09,Netflix’s affable killer defies death and cancellation in last season of You,0.029657429084181786,0.41414615511894226,0.5561964511871338
2023-02-16,Here’s my Netflix password — but you’ll have to pay for it,0.0293901264667511,0.04086397588253021,0.9297458529472351
2023-03-09,Luther: The Fallen Sun film review — Idris Elba’s detective decamps from BBC to Netflix,0.03575407341122627,0.1889469027519226,0.7752990126609802
2023-03-11,Money Shot: The Pornhub Story review — Netflix documentary lays bare abuse allegations,0.04150252044200897,0.0553312674164772,0.9031662344932556
2023-03-11,From ‘The Woman King’ to Netflix’s ‘African Queens’ — how Africa’s history went pop,0.0675363764166832,0.033612556755542755,0.8988510370254517
2023-04-03,Black comedy Beef brings LA road rage to Netflix — review,0.1620679348707199,0.019734494388103485,0.8181975483894348
2023-04-14,Transatlantic — new Netflix series paints wartime escapades with unexpected glamour,0.13796104490756989,0.03813012316823006,0.823908805847168
2023-04-18,Netflix: cheaper content and more subscribers won’t make up for disappointing forecasts Premium content,0.12505967915058136,0.582552969455719,0.29238730669021606
2023-04-19,Netflix delays account sharing crackdown after ‘cancel reaction’,0.012358173727989197,0.9018793702125549,0.08576256781816483
2023-04-21,"The Diplomat, Netflix review — an embarrassment to the embassy",0.03297482058405876,0.7650784850120544,0.20194672048091888
2023-04-25,South Korea’s entertainment wave grows with $2.5bn Netflix investment,0.8926205635070801,0.010453775525093079,0.09692566841840744
2023-05-12,Can Netflix really teach us ‘how to get rich’?,0.13050960004329681,0.020062271505594254,0.849428117275238
2023-05-16,Netflix alerts telecoms groups over looming account-sharing crackdown,0.010713919997215271,0.9472271800041199,0.042058952152729034
2023-05-26,Netflix is taking a necessary risk in tackling its 100mn freeloaders,0.14874452352523804,0.031075535342097282,0.8201798796653748
2023-06-07,"Charlie Brooker on satirising TV in Black Mirror: ‘If it wasn’t on Netflix, we’d be sued’",0.040423113852739334,0.6134394407272339,0.3461374044418335
2023-06-15,Black Mirror Series 6 — is it time for the Netflix sci-fi satire to call it a day?,0.024700889363884926,0.12354258447885513,0.8517565727233887
2023-07-03,Netflix to revamp advertising strategy to lure brands and boost revenues,0.9093539118766785,0.008372001349925995,0.08227413892745972
2023-07-06,film review — larky Netflix documentary plays mostly the hits,0.034673288464546204,0.03451688960194588,0.9308097958564758
2023-07-13,US tech can’t quit China and Netflix dives into Asia Premium content,0.07365812361240387,0.03750947490334511,0.8888323903083801
2023-07-19,Netflix’s password-sharing crackdown pays off with nearly 6mn new subscribers,0.8181052207946777,0.1211671531200409,0.06072760373353958
2023-07-20,Nasdaq drops more than 2% after Netflix and Tesla results disappoint,0.008816181682050228,0.9684791564941406,0.0227047111839056
2023-07-20,"Netflix: password sharing cutback provides shortlived gain  Premium
 content",0.6616250872612,0.016368955373764038,0.322005957365036
2023-07-21,FirstFT: Tesla and Netflix lead tech sell-off,0.0291361752897501,0.7917231917381287,0.17914065718650818
2023-09-01,"Top Boy series 3 review — brilliant, bruising drama comes to an end on Netflix",0.04575690999627113,0.18147237598896027,0.7727707624435425
2023-09-22,It’s Always Sunny in Philadelphia returns for a 16th shot on Netflix,0.1637934148311615,0.025870155543088913,0.8103364706039429
2023-09-26,"Streaming will transform video games just like Netflix changed TV, says Ubisoft",0.18013449013233185,0.009523428045213223,0.8103421330451965
2023-10-04,Beckham — footballer and sex symbol keeps a clean sheet on Netflix,0.05603165924549103,0.09344559162855148,0.8505227565765381
2023-10-06,Netflix and bill — the high price of a subscription lifestyle,0.2278055101633072,0.09691649675369263,0.6752779483795166
2023-10-17,‘Netflix effect’ returns as studios license old shows to their streaming rival,0.11483289301395416,0.03266210854053497,0.8525049686431885
2023-10-19,Bodies TV review — Netflix jams four police dramas into one time-hopping series,0.03592024743556976,0.0415651910007,0.9225146174430847
2023-10-19,Netflix shares jump after password crackdown boosts subscriptions,0.07928703725337982,0.890756368637085,0.029956607148051262
2023-10-19,"Netflix: revenue boost from password crackdown unlikely to spawn a sequel Premium
 content",0.9453304409980774,0.025493865832686424,0.02917565405368805
2023-10-30,All the Light We Cannot See review — trite second-world-war saga on Netflix,0.03668997809290886,0.272297203540802,0.6910127997398376
2023-11-03,Sly — Netflix’s Sylvester Stallone documentary is punchy and unexpectedly poignant,0.20722696185112,0.01655777171254158,0.7762152552604675
2023-11-07,Netflix is unlikely $70mn saviour of LA’s venerable Egyptian Theatre,0.21108606457710266,0.011803729459643364,0.77711021900177
2023-11-10,"Robbie Williams, Netflix review — the polished inside story of the megastar",0.1154123842716217,0.019585929811000824,0.8650016784667969
2023-11-16,The Crown series 6 review — Elizabeth Debicki is transcendent in sumptuous Netflix drama,0.19145841896533966,0.019687745720148087,0.7888538837432861
2023-11-21,Squid Game: The Challenge TV review — Netflix megahit becomes an irresistible reality show,0.16097231209278107,0.018444053828716278,0.8205836415290833
2023-12-01,Transcript: Culture Chat — Netflix’s ‘The Crown’,0.04811229184269905,0.03342096135020256,0.9184666872024536
2023-12-12,Netflix reveals viewing data across entire catalogue for the first time,0.11133778840303421,0.012842054478824139,0.8758201599121094
2023-12-13,A series of rubbish charts about Netflix’s rubbish viewing data,0.022118419408798218,0.5072034001350403,0.4706781506538391
2023-12-20,"Carol & the End of the World, Netflix review — surprisingly tender apocalyptic cartoon",0.253396600484848,0.01392375212162733,0.7326796054840088
2023-12-27,Bitconned review — Netflix documentary about a fortune built on brazen lies,0.10258389264345169,0.03271150588989258,0.8647045493125916
2023-12-28,‘Shakeout has begun’ after $5bn streaming loss for Netflix rivals,0.07923547923564911,0.799941897392273,0.12082265317440033
2024-01-25,"Bloomberg Surveillance: Tesla Slumps, Netflix Soars (Podcast)",0.03663914278149605,0.2271115928888321,0.7362492084503174
2024-01-26,Netflix Eyes Best Week Since 2022 on Stunning Subscriber Jump,0.32530632615089417,0.13767904043197632,0.5370146632194519
2024-01-26,Netflix Offers Subscribers a Whole Cable Bundle,0.13336189091205597,0.008157829754054546,0.8584803342819214
